"(Uk)EN019138458","article","text","0251-1223","","QH301","560","Spatial distribution of Riptortus linearis (Fabr.) Adults on green Gram","","Dutta, S. K. ; Saikia, I. H.","UNIVERSITY CLAUDE-BERNARD, LYON","India","GEOBIOS -JODHPUR","4 issues per year","1994","21","2","","","","117","","GEOBIOS -JODHPUR 21(2), 117. (1994)","4116.901500"
"(Uk)EN019138460","article","text","0251-1223","","QH301","560","Some Physiological observations in the gut and Associated digestive Glands of House-Sparrow, Passer domesticus indicus","","Sheoran, V.","UNIVERSITY CLAUDE-BERNARD, LYON","India","GEOBIOS -JODHPUR","4 issues per year","1994","21","2","","","","122","","GEOBIOS -JODHPUR 21(2), 122. (1994)","4116.901500"
"(Uk)EN019138471","article","text","0251-1223","","QH301","560","Effect of Aldrin Toxicity on Plasma protein level of fresh water teleost, Clarias batrachus (Linn.)","","Thakur, Y. P.","UNIVERSITY CLAUDE-BERNARD, LYON","India","GEOBIOS -JODHPUR","4 issues per year","1994","21","2","","","","127","","GEOBIOS -JODHPUR 21(2), 127. (1994)","4116.901500"
"(Uk)EN019138483","article","text","0251-1223","","QH301","560","Growth and yield of Cowpea as influenced by Methods of irrigation","","Mathew, T. ; Mohammed Kunju, U. ; Suja, G.","UNIVERSITY CLAUDE-BERNARD, LYON","India","GEOBIOS -JODHPUR","4 issues per year","1994","21","2","","","","130","","GEOBIOS -JODHPUR 21(2), 130. (1994)","4116.901500"
"(Uk)EN019138495","article","text","0251-1223","","QH301","560","Effect of iron Deficiency on the distribution of Fe and P in two Chickpea cultivars that differ in Tolerance to iron Deficiency stress","","Mehrotra, S. C.","UNIVERSITY CLAUDE-BERNARD, LYON","India","GEOBIOS -JODHPUR","4 issues per year","1994","21","2","","","","134","","GEOBIOS -JODHPUR 21(2), 134. (1994)","4116.901500"
"(Uk)EN019138501","article","text","0251-1223","","QH301","560","Sublethal urea effect to Haematological indicators of Fish, Labeo rohita Fingerlings","","Perviz, D. A. ; Rajyasree, M.","UNIVERSITY CLAUDE-BERNARD, LYON","India","GEOBIOS -JODHPUR","4 issues per year","1994","21","2","","","","140","","GEOBIOS -JODHPUR 21(2), 140. (1994)","4116.901500"
"(Uk)EN019138513","article","text","0251-1223","","QH301","560","Incidence of fish Mortality in Lower Lake of Bhopal","","Nandan, M. J. ; Pani, S. ; Suresh, I. V. ; Wanganeo, A.","UNIVERSITY CLAUDE-BERNARD, LYON","India","GEOBIOS -JODHPUR","4 issues per year","1994","21","2","","","","145","","GEOBIOS -JODHPUR 21(2), 145. (1994)","4116.901500"
"(Uk)EN019138525","article","text","0251-1223","","QH301","560","Effect of Temperature on the Reduction of iron in an Aqueous medium","","Jain, P. ; Mehrotra, S. C.","UNIVERSITY CLAUDE-BERNARD, LYON","India","GEOBIOS -JODHPUR","4 issues per year","1994","21","2","","","","147","","GEOBIOS -JODHPUR 21(2), 147. (1994)","4116.901500"
"(Uk)EN019149857","article","text","0377-8398","","QE719","560","Coccospheres of a rare nannofossil species: Biantholithus sparsus Bramlette and Martini, 1964","","Mai, H. ; Romein, T. ; Willems, H.","","Netherlands","MARINE MICROPALAEONTOLOGY","4 issues per year","1994","24","1","","","","1","","MARINE MICROPALAEONTOLOGY 24(1), 1. (1994)","5376.400000"
"(Uk)EN019149869","article","text","0377-8398","","QE719","560","The influence of non-equilibrium isotope fractionation on the Quaternary calcareous nannofossil stable isotope signal or the southwest Pacific Ocean, DSDP Site 594","","Dudley, W. C. ; Nelson, C. S.","","Netherlands","MARINE MICROPALAEONTOLOGY","4 issues per year","1994","24","1","","","","3","","MARINE MICROPALAEONTOLOGY 24(1), 3. (1994)","5376.400000"
"(Uk)EN019149870","article","text","0377-8398","","QE719","560","Foraminiferal microhabitats in four marine environments around Japan","","Kitazato, H.","","Netherlands","MARINE MICROPALAEONTOLOGY","4 issues per year","1994","24","1","","","","29","","MARINE MICROPALAEONTOLOGY 24(1), 29. (1994)","5376.400000"
"(Uk)EN019149882","article","text","0377-8398","","QE719","560","Larger foraminifera from the Chagos Archipelago: their significance for Indian Ocean biogeography","","Murray, J. W.","","Netherlands","MARINE MICROPALAEONTOLOGY","4 issues per year","1994","24","1","","","","43","","MARINE MICROPALAEONTOLOGY 24(1), 43. (1994)","5376.400000"
"(Uk)EN019149894","article","text","0377-8398","","QE719","560","The use of Ostracoda to reconstruct the oxygen levels of Late Palaeozoic oceans","","Lethiers, F. ; Whatley, R.","","Netherlands","MARINE MICROPALAEONTOLOGY","4 issues per year","1994","24","1","","","","57","","MARINE MICROPALAEONTOLOGY 24(1), 57. (1994)","5376.400000"
"(Uk)EN019149900","article","text","0377-8398","","QE719","560","Ecology, morphology, stratigraphy, and the paleoceanographic significance of Cycladophora davisiana davisiana. Part I: Ecology and morphology","","Bjoerklund, K. R. ; Ciesielski, P. F.","","Netherlands","MARINE MICROPALAEONTOLOGY","4 issues per year","1994","24","1","","","","71","","MARINE MICROPALAEONTOLOGY 24(1), 71. (1994)","5376.400000"
"(Uk)EN019190407","article","text","0251-1223","","QH301","560","Regression approach in Plant Growth analysis","","Govil, S. R. ; Pandey, H. N.","UNIVERSITY CLAUDE-BERNARD, LYON","India","GEOBIOS -JODHPUR","4 issues per year","1993","20","","","","","3","","GEOBIOS -JODHPUR 20, 3. (1993)","4116.901500"
"(Uk)EN019190419","article","text","0251-1223","","QH301","560","In vitro effect of Phytohormones on Tissue cultures of Cluster Bean (Cyamopsis tetragonoloba (L.) Taub)","","Ayodhya Ramulu, C. ; Rao, D.","UNIVERSITY CLAUDE-BERNARD, LYON","India","GEOBIOS -JODHPUR","4 issues per year","1993","20","","","","","7","","GEOBIOS -JODHPUR 20, 7. (1993)","4116.901500"
"(Uk)EN019190420","article","text","0251-1223","","QH301","560","Tolerance of Anabaena oryzae to salt stress","","Kaushik, A. ; Sethi, V.","UNIVERSITY CLAUDE-BERNARD, LYON","India","GEOBIOS -JODHPUR","4 issues per year","1993","20","","","","","10","","GEOBIOS -JODHPUR 20, 10. (1993)","4116.901500"
"(Uk)EN019190432","article","text","0251-1223","","QH301","560","Effect of Treated Refinery waste water on Nitrate reductase activity of Vigna radiata L","","Aziz, O. ; Inam, A. ; Tarannum, K.","UNIVERSITY CLAUDE-BERNARD, LYON","India","GEOBIOS -JODHPUR","4 issues per year","1993","20","","","","","14","","GEOBIOS -JODHPUR 20, 14. (1993)","4116.901500"
"(Uk)EN019190444","article","text","0251-1223","","QH301","560","Impact of Mathura Oil Refinery Effluent on seedling emergence of Triticale and Wheat","","Aziz, O. ; Inam, A. ; Tarannum, K.","UNIVERSITY CLAUDE-BERNARD, LYON","India","GEOBIOS -JODHPUR","4 issues per year","1993","20","","","","","16","","GEOBIOS -JODHPUR 20, 16. (1993)","4116.901500"
"(Uk)EN019190456","article","text","0251-1223","","QH301","560","Changes in protein content in peel and pulp of two Banana varieties","","Mugugaiyan, S.","UNIVERSITY CLAUDE-BERNARD, LYON","India","GEOBIOS -JODHPUR","4 issues per year","1993","20","","","","","18","","GEOBIOS -JODHPUR 20, 18. (1993)","4116.901500"
"(Uk)EN019190468","article","text","0251-1223","","QH301","560","Modification of seedling growth of Husk tomato by seed-applied plant growth regulators and gamma rays","","Raghava, N. ; Raghava, R. P.","UNIVERSITY CLAUDE-BERNARD, LYON","India","GEOBIOS -JODHPUR","4 issues per year","1993","20","","","","","21","","GEOBIOS -JODHPUR 20, 21. (1993)","4116.901500"
"(Uk)EN019190470","article","text","0251-1223","","QH301","560","Response of two cultivars of Indian Mustard (Brassica juncea (L.) Czern & Coss.) to distillery effluent","","Bhatia, I. ; Elcey, C. D. ; Tiwari, D.","UNIVERSITY CLAUDE-BERNARD, LYON","India","GEOBIOS -JODHPUR","4 issues per year","1993","20","","","","","27","","GEOBIOS -JODHPUR 20, 27. (1993)","4116.901500"
"(Uk)EN019190481","article","text","0251-1223","","QH301","560","Effect of pH and media on the Incidence of Phoma medicaginis var. sojae in soybean seeds","","Shukla, C. S.","UNIVERSITY CLAUDE-BERNARD, LYON","India","GEOBIOS -JODHPUR","4 issues per year","1993","20","","","","","33","","GEOBIOS -JODHPUR 20, 33. (1993)","4116.901500"
"(Uk)EN019190493","article","text","0251-1223","","QH301","560","Variation in the Haemolymph Quantum amongst different ecoraces and Fl's of top cross of Antheraea mylitta D","","Dubey, O. P. ; Kar, P. K. ; Sinha, R. K. ; Srivastava, P. P.","UNIVERSITY CLAUDE-BERNARD, LYON","India","GEOBIOS -JODHPUR","4 issues per year","1993","20","","","","","36","","GEOBIOS -JODHPUR 20, 36. (1993)","4116.901500"
"(Uk)EN019190500","article","text","0251-1223","","QH301","560","Variability in production of cellulases by three species of Pestalotiopsis","","Madhukar, J. ; Reddy, S. M.","UNIVERSITY CLAUDE-BERNARD, LYON","India","GEOBIOS -JODHPUR","4 issues per year","1993","20","","","","","41","","GEOBIOS -JODHPUR 20, 41. (1993)","4116.901500"
"(Uk)EN019958085","article","text","0031-0182","","QE500","560.45","Oceanography of the Gulf of Tehuantepec, Mexico, indicated by Radiolaria remains","","Martinez-Lopez, M. ; Molina-Cruz, A.","","Netherlands","PALAEOGEOGRAPHY PALAEOCLIMATOLOGY PALAEOECOLOGY","monthly","1994","110","3/4","","","","179","","PALAEOGEOGRAPHY PALAEOCLIMATOLOGY PALAEOECOLOGY 110(3/4), 179. (1994)","6343.450000"
"(Uk)EN019958097","article","text","0031-0182","","QE500","560.45","Pedogenesis and paleoclimatic implications of the Chamberlain Pass Formation, Basal White River Group, Badlands of South Dakota","","Evans, J. E. ; Terry, D. O.","","Netherlands","PALAEOGEOGRAPHY PALAEOCLIMATOLOGY PALAEOECOLOGY","monthly","1994","110","3/4","","","","197","","PALAEOGEOGRAPHY PALAEOCLIMATOLOGY PALAEOECOLOGY 110(3/4), 197. (1994)","6343.450000"
"(Uk)EN019958103","article","text","0031-0182","","QE500","560.45","The last 140 ka in the Afro-Asian arid/semi-arid transitional zone","","Petit-Maire, N. ; Yan, Z.","","Netherlands","PALAEOGEOGRAPHY PALAEOCLIMATOLOGY PALAEOECOLOGY","monthly","1994","110","3/4","","","","217","","PALAEOGEOGRAPHY PALAEOCLIMATOLOGY PALAEOECOLOGY 110(3/4), 217. (1994)","6343.450000"
"(Uk)EN019958115","article","text","0031-0182","","QE500","560.45","Palaeogeography and geodynamic evolution of the Gosau Group of the Northern Calcareous Alps (Late Cretaceous, Eastern Alps, Austria)","","Faupl, P. ; Wagreich, M.","","Netherlands","PALAEOGEOGRAPHY PALAEOCLIMATOLOGY PALAEOECOLOGY","monthly","1994","110","3/4","","","","235","","PALAEOGEOGRAPHY PALAEOCLIMATOLOGY PALAEOECOLOGY 110(3/4), 235. (1994)","6343.450000"
"(Uk)EN019958127","article","text","0031-0182","","QE500","560.45","Transgressions: rethinking Beringian glaciation","","Hughes, B. A. ; Hughes, T. J.","","Netherlands","PALAEOGEOGRAPHY PALAEOCLIMATOLOGY PALAEOECOLOGY","monthly","1994","110","3/4","","","","275","","PALAEOGEOGRAPHY PALAEOCLIMATOLOGY PALAEOECOLOGY 110(3/4), 275. (1994)","6343.450000"
"(Uk)EN019958139","article","text","0031-0182","","QE500","560.45","Three-dimensional reconstruction of an in-situ Miocene peat forest from the Lower Rhine Embayment, northwestern Germany-new methods in palaeovegetation analysis","","Ashraf, A. R. ; Belz, G. ; Gee, C. T. ; Mosbrugger, V.","","Netherlands","PALAEOGEOGRAPHY PALAEOCLIMATOLOGY PALAEOECOLOGY","monthly","1994","110","3/4","","","","295","","PALAEOGEOGRAPHY PALAEOCLIMATOLOGY PALAEOECOLOGY 110(3/4), 295. (1994)","6343.450000"
"(Uk)EN019958140","article","text","0031-0182","","QE500","560.45","Hemiasterid echinoids (Echinodermata: Spatangoida) from the Cretaceous Tethys to the present-day Mediterranean","","Neraudeau, D.","","Netherlands","PALAEOGEOGRAPHY PALAEOCLIMATOLOGY PALAEOECOLOGY","monthly","1994","110","3/4","","","","319","","PALAEOGEOGRAPHY PALAEOCLIMATOLOGY PALAEOECOLOGY 110(3/4), 319. (1994)","6343.450000"
"(Uk)EN019958152","article","text","0031-0182","","QE500","560.45","Climatic signals from loess-soil sequences in the central Great Plains, USA","","Feng, Z. ; Johnson, W. C. ; Lu, Y. ; Ward, P. A.","","Netherlands","PALAEOGEOGRAPHY PALAEOCLIMATOLOGY PALAEOECOLOGY","monthly","1994","110","3/4","","","","345","","PALAEOGEOGRAPHY PALAEOCLIMATOLOGY PALAEOECOLOGY 110(3/4), 345. (1994)","6343.450000"
"(Uk)EN020656372","article","text","0094-8373","","QE701","560","Paleontological data and molecular phylogenetic analysis","","Littlewood, D. T. J. ; Smith, A. B.","PALEOBIOLOGY","United States","PALEOBIOLOGY -CHICAGO","4 issues per year","1994","20","3","","","","259","","PALEOBIOLOGY -CHICAGO 20(3), 259. (1994)","6345.280000"
"(Uk)EN020656384","article","text","0094-8373","","QE701","560","Effects of the Mesozoic Marine Revolution on the taxonomic, morphologic, and biogeographic evolution of a group: aporrhaid gastropods during the Mesozoic","","Roy, K.","PALEOBIOLOGY","United States","PALEOBIOLOGY -CHICAGO","4 issues per year","1994","20","3","","","","274","","PALEOBIOLOGY -CHICAGO 20(3), 274. (1994)","6345.280000"
"(Uk)EN020656396","article","text","0094-8373","","QE701","560","The plankton and the benthos: origins and early history of an evolving relationship","","Signor, P. W. ; Vermeij, G. J.","PALEOBIOLOGY","United States","PALEOBIOLOGY -CHICAGO","4 issues per year","1994","20","3","","","","297","","PALEOBIOLOGY -CHICAGO 20(3), 297. (1994)","6345.280000"
"(Uk)EN020656402","article","text","0094-8373","","QE701","560","Morphological disparity in Ordovician-Devonian crinoids and the early saturation of morphological space","","Foote, M.","PALEOBIOLOGY","United States","PALEOBIOLOGY -CHICAGO","4 issues per year","1994","20","3","","","","320","","PALEOBIOLOGY -CHICAGO 20(3), 320. (1994)","6345.280000"
"(Uk)EN020656414","article","text","0094-8373","","QE701","560","Demise of the middle Paleozoic crinoid fauna: a single extinction event or rapid faunal turnover?","","Ausich, W. I. ; Baumiller, T. K. ; Kammer, T. W.","PALEOBIOLOGY","United States","PALEOBIOLOGY -CHICAGO","4 issues per year","1994","20","3","","","","345","","PALEOBIOLOGY -CHICAGO 20(3), 345. (1994)","6345.280000"
"(Uk)EN020656426","article","text","0094-8373","","QE701","560","Hybrid crinoids in the fossil record (Early Mississippian, Phylum Echinodermata)","","Ausich, W. I. ; Meyer, D. L.","PALEOBIOLOGY","United States","PALEOBIOLOGY -CHICAGO","4 issues per year","1994","20","3","","","","362","","PALEOBIOLOGY -CHICAGO 20(3), 362. (1994)","6345.280000"
"(Uk)EN020656438","case study/report","text","0094-8373","","QE701","560","The promotion and prevention of recoiling in a maximally snaillike vermetid gastropod: a case study for the centenary of Dollo's Law","","Gould, S. J. ; Robinson, B. A.","PALEOBIOLOGY","United States","PALEOBIOLOGY -CHICAGO","4 issues per year","1994","20","3","","","","368","","PALEOBIOLOGY -CHICAGO 20(3), 368. (1994)","6345.280000"
"(Uk)EN020656440","article","text","0094-8373","","QE701","560","Stable isotopic signals and photosymbiosis in Late Paleocene planktic foraminifera","","D'Hondt, S. ; Schultz, G. ; Zachos, J. C.","PALEOBIOLOGY","United States","PALEOBIOLOGY -CHICAGO","4 issues per year","1994","20","3","","","","391","","PALEOBIOLOGY -CHICAGO 20(3), 391. (1994)","6345.280000"
"(Uk)EN021151014","article","text","0251-1223","","QH301","560","Temperature Dependent Responses of Lymnaea acuminata (Lamark) to Copper sulphate","","Durve, V. S. ; Gupta, A. K. ; Mathur, S.","UNIVERSITY CLAUDE-BERNARD, LYON","India","GEOBIOS -JODHPUR","4 issues per year","1994","21","3","","","","149","","GEOBIOS -JODHPUR 21(3), 149. (1994)","4116.901500"
"(Uk)EN021151026","article","text","0251-1223","","QH301","560","Lipid concentration in the Pupal Haemolymph of different Races and F'1s of Six Crosses of Antheraea mylitta Drury","","Kar, P. K. ; Sinha, R. K. ; Srivastava, P. P. ; Thangavelu, K.","UNIVERSITY CLAUDE-BERNARD, LYON","India","GEOBIOS -JODHPUR","4 issues per year","1994","21","3","","","","155","","GEOBIOS -JODHPUR 21(3), 155. (1994)","4116.901500"
"(Uk)EN021151038","article","text","0251-1223","","QH301","560","Effect of Chrome Salt on Soil Bacteria","","Gomathinayagam, P. ; Lakshmanaperumalsamy, P. ; Shiek Mujibur Rahman, P. K.","UNIVERSITY CLAUDE-BERNARD, LYON","India","GEOBIOS -JODHPUR","4 issues per year","1994","21","3","","","","159","","GEOBIOS -JODHPUR 21(3), 159. (1994)","4116.901500"
"(Uk)EN021151040","article","text","0251-1223","","QH301","560","Toxicity of Natural Essential Oils to Mosquitoes, Aedes aegypti and Culex fatigans","","Deshpande, S. G. ; Joseph, M. ; Sharma, R. N. ; Tungikar, V. B.","UNIVERSITY CLAUDE-BERNARD, LYON","India","GEOBIOS -JODHPUR","4 issues per year","1994","21","3","","","","162","","GEOBIOS -JODHPUR 21(3), 162. (1994)","4116.901500"
"(Uk)EN021151051","article","text","0251-1223","","QH301","560","Toxicity Evaluation of Herbal Smoke and Synthetic Mosquito Mat on Culex quinquefasciatus Say","","Manoharan, A. C. ; Revathy, C. ; Selvaraj Pandian, R.","UNIVERSITY CLAUDE-BERNARD, LYON","India","GEOBIOS -JODHPUR","4 issues per year","1994","21","3","","","","166","","GEOBIOS -JODHPUR 21(3), 166. (1994)","4116.901500"
"(Uk)EN021151063","article","text","0251-1223","","QH301","560","Fermentative Production of Citric acid by Aspergillus japonicus: Effect of Phosphorus source","","Karkashe, R. ; Sonar, M. L.","UNIVERSITY CLAUDE-BERNARD, LYON","India","GEOBIOS -JODHPUR","4 issues per year","1994","21","3","","","","169","","GEOBIOS -JODHPUR 21(3), 169. (1994)","4116.901500"
"(Uk)EN021151075","article","text","0251-1223","","QH301","560","Antifungal Activity of Neemgold against Two Soil-borne Plant Pathogenic Fungi","","Diraviam, G. ; Mahalakshmi, V. K. ; Murugesan, K.","UNIVERSITY CLAUDE-BERNARD, LYON","India","GEOBIOS -JODHPUR","4 issues per year","1994","21","3","","","","173","","GEOBIOS -JODHPUR 21(3), 173. (1994)","4116.901500"
"(Uk)EN021151087","article","text","0251-1223","","QH301","560","Interaction between VA-Mycorrhizae and Rhizobium and their effects on Chickpea in unsterilized Soil","","Chandra, S. ; Harbans Kaur Kehri","UNIVERSITY CLAUDE-BERNARD, LYON","India","GEOBIOS -JODHPUR","4 issues per year","1994","21","3","","","","177","","GEOBIOS -JODHPUR 21(3), 177. (1994)","4116.901500"
"(Uk)EN021151099","article","text","0251-1223","","QH301","560","Studies on Agrosilvicultural systems under Rainfed and Light soil conditions of Madhya Pradesh","","Sharma, R. S. ; Shukla, V. K. ; Upadhyaya, S. P.","UNIVERSITY CLAUDE-BERNARD, LYON","India","GEOBIOS -JODHPUR","4 issues per year","1994","21","3","","","","182","","GEOBIOS -JODHPUR 21(3), 182. (1994)","4116.901500"
"(Uk)EN021151105","article","text","0251-1223","","QH301","560","Studies on Morpho-physiological changes in Maize under various intercropping Systems and Nitrogen supplies","","Sharma, R. S. ; Shukla, V. K.","UNIVERSITY CLAUDE-BERNARD, LYON","India","GEOBIOS -JODHPUR","4 issues per year","1994","21","3","","","","187","","GEOBIOS -JODHPUR 21(3), 187. (1994)","4116.901500"
"(Uk)EN021151117","article","text","0251-1223","","QH301","560","Absolute Population trend of Pieris brassicae L. larvae on Brassica oilseed Crops","","Dutta, S. K.","UNIVERSITY CLAUDE-BERNARD, LYON","India","GEOBIOS -JODHPUR","4 issues per year","1994","21","3","","","","192","","GEOBIOS -JODHPUR 21(3), 192. (1994)","4116.901500"
"(Uk)EN021151129","article","text","0251-1223","","QH301","560","Effect of Artificial Diets on the Fecundity of Macrobrachium jamarrei lamarrei","","Chakraborty, S. ; Qureshi, T. A.","UNIVERSITY CLAUDE-BERNARD, LYON","India","GEOBIOS -JODHPUR","4 issues per year","1994","21","3","","","","195","","GEOBIOS -JODHPUR 21(3), 195. (1994)","4116.901500"
"(Uk)EN021151130","article","text","0251-1223","","QH301","560","Effect of different wavelengths of Light on Germination, Seedling growth and Pigment contents of Sugarbeet","","Sharma, K. D.","UNIVERSITY CLAUDE-BERNARD, LYON","India","GEOBIOS -JODHPUR","4 issues per year","1994","21","3","","","","203","","GEOBIOS -JODHPUR 21(3), 203. (1994)","4116.901500"
"(Uk)EN021151142","article","text","0251-1223","","QH301","560","Effect of Sulphur Fungicide on Sulphur content, Yield and Diseases of different Economic crops","","Bhatia, J. N.","UNIVERSITY CLAUDE-BERNARD, LYON","India","GEOBIOS -JODHPUR","4 issues per year","1994","21","3","","","","206","","GEOBIOS -JODHPUR 21(3), 206. (1994)","4116.901500"
"(Uk)EN021151154","article","text","0251-1223","","QH301","560","Evaluation of Water-logged Soils from different localities of Gujarat","","Balaji, K.","UNIVERSITY CLAUDE-BERNARD, LYON","India","GEOBIOS -JODHPUR","4 issues per year","1994","21","3","","","","210","","GEOBIOS -JODHPUR 21(3), 210. (1994)","4116.901500"
"(Uk)EN021151166","article","text","0251-1223","","QH301","560","Response of Cicer arietinum L. to Rhizobium inoculation and Phosphorus","","Poonia, K. L.","UNIVERSITY CLAUDE-BERNARD, LYON","India","GEOBIOS -JODHPUR","4 issues per year","1994","21","3","","","","213","","GEOBIOS -JODHPUR 21(3), 213. (1994)","4116.901500"
"(Uk)EN021151178","article","text","0251-1223","","QH301","560","Responses of three Climacteric fruits to infection with Aspergillus niger in relation to Chemical composition","","Arunachalam, A. ; Dharmaraj, K.","UNIVERSITY CLAUDE-BERNARD, LYON","India","GEOBIOS -JODHPUR","4 issues per year","1994","21","3","","","","214","","GEOBIOS -JODHPUR 21(3), 214. (1994)","4116.901500"
"(Uk)EN022411688","article","text","0031-0182","","QE500","560.45","The use of trend surfaces in palaeoenvironmental reconstructions","","Le Roux, J. P.","","Netherlands","PALAEOGEOGRAPHY PALAEOCLIMATOLOGY PALAEOECOLOGY","monthly","1994","111","3/4","","","","185","","PALAEOGEOGRAPHY PALAEOCLIMATOLOGY PALAEOECOLOGY 111(3/4), 185. (1994)","6343.450000"
"(Uk)EN022411690","article","text","0031-0182","","QE500","560.45","Palaeoenvironmental reconstruction of a Pleistocene lacustrine sequence from faunal assemblages and ostracode shell geochemistry, Baza Basin, SE Spain","","Anadon, P. ; Julia, R. ; Utrilla, R.","","Netherlands","PALAEOGEOGRAPHY PALAEOCLIMATOLOGY PALAEOECOLOGY","monthly","1994","111","3/4","","","","191","","PALAEOGEOGRAPHY PALAEOCLIMATOLOGY PALAEOECOLOGY 111(3/4), 191. (1994)","6343.450000"
"(Uk)EN022411706","article","text","0031-0182","","QE500","560.45","Stable carbon and oxygen isotope compositions of mollusc shells from Britain and New Zealand","","Curry, G. B. ; Fallick, A. E. ; Mitchell, L.","","Netherlands","PALAEOGEOGRAPHY PALAEOCLIMATOLOGY PALAEOECOLOGY","monthly","1994","111","3/4","","","","207","","PALAEOGEOGRAPHY PALAEOCLIMATOLOGY PALAEOECOLOGY 111(3/4), 207. (1994)","6343.450000"
"(Uk)EN022411718","article","text","0031-0182","","QE500","560.45","Evidence for a relict glacial landscape in Quebec-Labrador","","Borgstroem, I. ; Haettestrand, C. ; Kleman, J.","","Netherlands","PALAEOGEOGRAPHY PALAEOCLIMATOLOGY PALAEOECOLOGY","monthly","1994","111","3/4","","","","217","","PALAEOGEOGRAPHY PALAEOCLIMATOLOGY PALAEOECOLOGY 111(3/4), 217. (1994)","6343.450000"
"(Uk)EN022411720","article","text","0031-0182","","QE500","560.45","Last glacial 'coastal' dunes in Eastern Australia and implications for landscape stability during the Last Glacial Maximum","","Bryant, E. ; Hesp, P. ; Thom, B.","","Netherlands","PALAEOGEOGRAPHY PALAEOCLIMATOLOGY PALAEOECOLOGY","monthly","1994","111","3/4","","","","229","","PALAEOGEOGRAPHY PALAEOCLIMATOLOGY PALAEOECOLOGY 111(3/4), 229. (1994)","6343.450000"
"(Uk)EN022411731","article","text","0031-0182","","QE500","560.45","Magnetostratigraphy and biostratigraphy of an Anisian-Ladinian (Middle Triassic) boundary section from Hydra (Greece)","","Channell, J. E. T. ; Muttoni, G. ; Nicora, A. ; Rettori, R.","","Netherlands","PALAEOGEOGRAPHY PALAEOCLIMATOLOGY PALAEOECOLOGY","monthly","1994","111","3/4","","","","249","","PALAEOGEOGRAPHY PALAEOCLIMATOLOGY PALAEOECOLOGY 111(3/4), 249. (1994)","6343.450000"
"(Uk)EN022411743","article","text","0031-0182","","QE500","560.45","Lower Cretaceous carbonate platform facies, Western Carpathians","","Michalik, J.","","Netherlands","PALAEOGEOGRAPHY PALAEOCLIMATOLOGY PALAEOECOLOGY","monthly","1994","111","3/4","","","","263","","PALAEOGEOGRAPHY PALAEOCLIMATOLOGY PALAEOECOLOGY 111(3/4), 263. (1994)","6343.450000"
"(Uk)EN022411755","article","text","0031-0182","","QE500","560.45","Fire, climate, and the persistence of desert varnish near Dampier, Western Australia","","Dragovich, D.","","Netherlands","PALAEOGEOGRAPHY PALAEOCLIMATOLOGY PALAEOECOLOGY","monthly","1994","111","3/4","","","","279","","PALAEOGEOGRAPHY PALAEOCLIMATOLOGY PALAEOECOLOGY 111(3/4), 279. (1994)","6343.450000"
"(Uk)EN022411767","article","text","0031-0182","","QE500","560.45","Micromorphology of the Belyuan loess-paleosol sequence in Gansu Province, China: geomorphological and paleo-environmental significance","","Derbyshire, E. ; Fang, X. ; Fitzpatrick, E. A. ; Li, J.","","Netherlands","PALAEOGEOGRAPHY PALAEOCLIMATOLOGY PALAEOECOLOGY","monthly","1994","111","3/4","","","","289","","PALAEOGEOGRAPHY PALAEOCLIMATOLOGY PALAEOECOLOGY 111(3/4), 289. (1994)","6343.450000"
"(Uk)EN022411779","article","text","0031-0182","","QE500","560.45","The evolution of biodiversity among the Southwest European Neogene rodent (Mammalia, Rodentia) communities: pattern and process of diversification and extinction","","Jaeger, J.-J.","","Netherlands","PALAEOGEOGRAPHY PALAEOCLIMATOLOGY PALAEOECOLOGY","monthly","1994","111","3/4","","","","305","","PALAEOGEOGRAPHY PALAEOCLIMATOLOGY PALAEOECOLOGY 111(3/4), 305. (1994)","6343.450000"
"(Uk)EN022411780","article","text","0031-0182","","QE500","560.45","Browse Basin, Northwest Australia: the evolution, palaeogeography and petroleum potential of a passive continental margin","","Cadman, S. J. ; Stephenson, A. E.","","Netherlands","PALAEOGEOGRAPHY PALAEOCLIMATOLOGY PALAEOECOLOGY","monthly","1994","111","3/4","","","","337","","PALAEOGEOGRAPHY PALAEOCLIMATOLOGY PALAEOECOLOGY 111(3/4), 337. (1994)","6343.450000"
